{
  "type": "PhenologyIndicatorProvenance",
  "title": "Provenance for Finland EBV phenology indicators",
  "description": "Lineage record describing how the Phenology Indicators example was derived from the original NetCDF EBV phenology dataset using national-scale annual spatial aggregation and temporal analysis.",
  "source_dataset": {
    "id": "geobon-dataset-10-v2",
    "title": "Vegetation Phenology in Finland",
    "doi": "10.25829/xf8ek6",
    "product_version": "2",
    "date_created": "2020-11-04",
    "date_issued": "2023-07-18",
    "license": "https://creativecommons.org/licenses/by/4.0",
    "source_file": "/10/public/bottcher_ecofun_id10_20230718_v2.nc",
    "download": "portal.geobon.org/data/upload/10/public/bottcher_ecofun_id10_20230718_v2.nc",
    "metadata_json": "portal.geobon.org/data/upload/10/public/metadata_v2.json",
    "metadata_xml": "portal.geobon.org/data/upload/10/public/metadata_v2.xml",
    "spatial_scope": "Finland",
    "spatial_resolution": {
      "lat_resolution": "0.066428063829064 degree",
      "lon_resolution": "0.066428063829064 degree"
    },
    "geospatial_bounds": {
      "crs": "EPSG:4326",
      "lat_min": 57.7532613743371,
      "lat_max": 71.171730267808,
      "lon_min": 14.1011663430375,
      "lon_max": 35.2252906406799
    },
    "temporal_coverage": {
      "time_coverage_resolution": "P0001-00-00",
      "time_coverage_start": "2001-01-01",
      "time_coverage_end": "2018-01-01"
    },
    "ebv": {
      "class": "Ecosystem functioning",
      "name": "Ecosystem phenology",
      "domain": [
        "Terrestrial"
      ],
      "entity_type": "Ecosystems",
      "entity_scope": "Coniferous and deciduous forests",
      "entity_names": [
        "Coniferous",
        "Deciduous"
      ],
      "metric": {
        ":standard_name": "Start of the vegetation active period (VAP)",
        ":long_name": "The start of the vegetation active period (VAP) in coniferous forest (Day of Year) is defined as the day when the trees start to photosynthesize in spring. The data set was derived from Moderate Resolution Imaging Spetroradiometer (MODIS) satellite observation of Fractional Snow Cover. The day when snow cover decreases during spring melt was used as a proxy indicator for the beginning of the start of the vegetation active period. The start of the vegetation active period (VAP) in deciduous vegetation (Day of Year) is defined as the day when deciduous trees unfold new leaves in spring. It is also often referred to as the green-up or greening day. The data set was derived from time series of the Normalized Difference Water Index (NDWI) calculated from Moderate Resolution Imaging Spetroradiometer (MODIS) satellite observation.",
        ":units": "Day of year"
      }
    }
  },
  "agents": [
    {
      "id": "agent:syke",
      "type": "Organization",
      "name": "Finnish Environment Institute (SYKE)",
      "role": "original data creator and publisher"
    },
    {
      "id": "agent:kristin-bottcher",
      "type": "Person",
      "name": "Kristin B\u00f6ttcher",
      "institution": "The Finnish Environment Institute (SYKE)",
      "role": "dataset creator"
    },
    {
      "id": "agent:modis-terra",
      "type": "InstrumentPlatform",
      "name": "MODIS Terra",
      "role": "satellite observation source"
    },
    {
      "id": "agent:phenology-indicator-script",
      "type": "SoftwareAgent",
      "name": "Phenology indicator derivation script",
      "role": "derivation of temporal phenology indicators from the NetCDF cube"
    },
    {
      "id": "agent:ogc-bblocks-workflow",
      "type": "SoftwareAgent",
      "name": "OGC Building Blocks workflow",
      "role": "validation, annotation and publication of Building Block examples"
    }
  ],
  "entities": [
    {
      "id": "entity:modis-observations",
      "type": "prov:Entity",
      "label": "MODIS Terra satellite observations",
      "description": "Remote sensing observations used as source input for the original VAP products."
    },
    {
      "id": "entity:source-netcdf",
      "type": "prov:Entity",
      "label": "Original EBV phenology NetCDF cube",
      "format": "NetCDF",
      "path": "/10/public/bottcher_ecofun_id10_20230718_v2.nc",
      "wasAttributedTo": "agent:syke"
    },
    {
      "id": "entity:source-metadata-json",
      "type": "prov:Entity",
      "label": "Dataset metadata JSON",
      "format": "JSON",
      "path": "portal.geobon.org/data/upload/10/public/metadata_v2.json",
      "wasAttributedTo": "agent:syke"
    },
    {
      "id": "entity:annual-spatial-means",
      "type": "prov:Entity",
      "label": "Annual spatial means",
      "description": "Intermediate table with one national-scale annual mean VAP day-of-year per EBV entity."
    },
    {
      "id": "entity:phenology-indicators-json",
      "type": "prov:Entity",
      "label": "Derived phenology indicators JSON",
      "format": "JSON",
      "path": "_sources/phenology-indicators/examples/finland-phenology-indicators-full-series.json"
    },
    {
      "id": "entity:phenology-indicators-provenance",
      "type": "prov:Entity",
      "label": "Provenance record for derived phenology indicators",
      "format": "JSON",
      "path": "_sources/data-provenance/examples/finland-phenology-indicators-provenance.json"
    }
  ],
  "activities": [
    {
      "id": "activity:remote-sensing-acquisition",
      "type": "prov:Activity",
      "label": "Acquire MODIS observations",
      "generated": "entity:modis-observations",
      "wasAssociatedWith": "agent:modis-terra"
    },
    {
      "id": "activity:derive-vap-products",
      "type": "prov:Activity",
      "label": "Derive annual VAP raster products",
      "used": [
        "entity:modis-observations"
      ],
      "generated": "entity:source-netcdf",
      "wasAssociatedWith": "agent:syke",
      "method_summary": [
        "MODIS Level 1B data were calibrated to top-of-atmosphere reflectances.",
        "Fractional Snow Cover (FSC) and NDWI were calculated.",
        "Cloud covered observations were removed.",
        "For coniferous forest, FSC time series were used as proxy for VAP onset.",
        "For deciduous vegetation, NDWI time series were used.",
        "Yearly VAP maps were smoothed with a median filter and open water areas were masked."
      ]
    },
    {
      "id": "activity:read-source-cube",
      "type": "prov:Activity",
      "label": "Read EBV cube from NetCDF",
      "used": [
        "entity:source-netcdf",
        "entity:source-metadata-json"
      ],
      "wasAssociatedWith": "agent:phenology-indicator-script",
      "parameters": {
        "source_variable": "metric_1/ebv_cube",
        "dimensions": [
          "entity",
          "time",
          "lat",
          "lon"
        ],
        "fill_value_handling": "Fill values were converted to null / NaN before aggregation."
      }
    },
    {
      "id": "activity:aggregate-annual-spatial-means",
      "type": "prov:Activity",
      "label": "Aggregate annual national-scale spatial means",
      "used": [
        "entity:source-netcdf"
      ],
      "generated": "entity:annual-spatial-means",
      "wasAssociatedWith": "agent:phenology-indicator-script",
      "parameters": {
        "spatial_aggregation": "mean over valid raster cells",
        "spatial_scope": "Finland",
        "entities": [
          "Coniferous",
          "Deciduous"
        ],
        "years": [
          2001,
          2002,
          2003,
          2004,
          2005,
          2006,
          2007,
          2008,
          2009,
          2010,
          2011,
          2012,
          2013,
          2014,
          2015,
          2016,
          2017,
          2018
        ]
      }
    },
    {
      "id": "activity:compute-phenology-indicators",
      "type": "prov:Activity",
      "label": "Compute temporal phenology indicators",
      "used": [
        "entity:annual-spatial-means"
      ],
      "generated": "entity:phenology-indicators-json",
      "wasAssociatedWith": "agent:phenology-indicator-script",
      "parameters": {
        "linear_trend": "Ordinary least squares regression of annual mean VAP day-of-year against year.",
        "anomaly_index": "Annual anomaly against a 2001\u20132010 baseline mean and standard deviation.",
        "change_point": "Two-segment linear regression selected by minimum sum of squared errors, with at least five years per segment.",
        "acceleration": "Quadratic fit to annual mean VAP day-of-year."
      }
    },
    {
      "id": "activity:publish-building-block-examples",
      "type": "prov:Activity",
      "label": "Publish Building Block examples",
      "used": [
        "entity:phenology-indicators-json",
        "entity:phenology-indicators-provenance"
      ],
      "wasAssociatedWith": "agent:ogc-bblocks-workflow"
    }
  ],
  "lineage": [
    {
      "subject": "entity:modis-observations",
      "predicate": "prov:wasGeneratedBy",
      "object": "activity:remote-sensing-acquisition"
    },
    {
      "subject": "entity:source-netcdf",
      "predicate": "prov:wasGeneratedBy",
      "object": "activity:derive-vap-products"
    },
    {
      "subject": "activity:derive-vap-products",
      "predicate": "prov:used",
      "object": "entity:modis-observations"
    },
    {
      "subject": "entity:annual-spatial-means",
      "predicate": "prov:wasGeneratedBy",
      "object": "activity:aggregate-annual-spatial-means"
    },
    {
      "subject": "activity:aggregate-annual-spatial-means",
      "predicate": "prov:used",
      "object": "entity:source-netcdf"
    },
    {
      "subject": "entity:phenology-indicators-json",
      "predicate": "prov:wasGeneratedBy",
      "object": "activity:compute-phenology-indicators"
    },
    {
      "subject": "activity:compute-phenology-indicators",
      "predicate": "prov:used",
      "object": "entity:annual-spatial-means"
    }
  ],
  "derived_indicator_summary": [